{
  "boundary": {
    "cgroup_v2": true,
    "daemon_sockets": false,
    "disposable": true,
    "host_mounts": false,
    "mount_namespace": true,
    "network_mode": "DENY_ALL",
    "no_secrets": true,
    "pid_namespace": true,
    "rootless": true,
    "run_as_gid": 10001,
    "run_as_uid": 10001
  },
  "candidate_archive_sha256": "aaaaaaaaaaaaaaaaaaaaaaaaaaaaaaaaaaaaaaaaaaaaaaaaaaaaaaaaaaaaaaaa",
  "challenge_sha256": "bbbbbbbbbbbbbbbbbbbbbbbbbbbbbbbbbbbbbbbbbbbbbbbbbbbbbbbbbbbbbbbb",
  "completed_at": "2026-08-07T00:53:32.037516+00:00",
  "envelope_kind": "AZPR_V10_1_NO_SECRET_PROBE_RESULT",
  "exit_code": 0,
  "format_version": "1.1",
  "host_id": "host-v10-1-test-0001",
  "observations": {
    "daemon_access_denied": true,
    "escape_denied": true,
    "evidence_mutation_denied": true,
    "host_read_denied": true,
    "mount_denied": true,
    "network_denied": true,
    "resource_exhaustion_contained": true,
    "secret_read_denied": true
  },
  "probe_attestor_keyring_sha256": "9b532448a7f62074aac428fc0367dc94f0e725c51100f81af81491fa2e99f3c7",
  "probe_attestor_revocation_state_sha256": "0d2b28f91f6593cb47157631df7e40b856facb5364d05bcc072e29db106608bb",
  "probe_keyring_sha256": "db8c87809d13ba3531e466769c941e0c57db893f2fc2a41336b9fc2493f44512",
  "probe_policy_sha256": "f1ff2eaad2db77e472e68bb52de8a69deb5c7fbea5ca91da1182c8b6fdbc8f34",
  "probe_revocation_state_sha256": "1c59351b4a333cb15fa84ef093e56b706e68ee3405f214d3bfd2423b2dc760e0",
  "probe_service_attestation_sha256": "ffffffffffffffffffffffffffffffffffffffffffffffffffffffffffffffff",
  "probe_service_executable_sha256": "306c6ca7407560340797866e077e053627ad409277d1b9da58106fce4cf717cb",
  "probe_service_identity_sha256": "4b00f2125d58f084b2f99040caceb7560ab330b3f9f47a6e149195518c326a5f",
  "qualification_trust_manifest_sha256": "883ed492f9074bd42fa6984aa6d96c0079d23ffbf6e699f6481030e374430db0",
  "signature": "WIfnfMwyQTu5kfyDB9HWYx/JYnLrQyrQiBfyBKiPR0z3cQUeNx3IBQi6BCkdFryMHHdvuN5TPCdyZe1zghTIBA==",
  "signer_key_id": "probe-key-v10-1-0001",
  "signer_service_id": "probe-service-v10-1-0001",
  "started_at": "2026-08-07T00:53:31.037516+00:00",
  "target_role": "git_binary",
  "target_sha256": "5652a8fbda6d0e045ced6b410e1f2cb27be6c55826d89d61a4ed18b8d4637481"
}
