{
  "boundary": {
    "cgroup_v2": true,
    "daemon_sockets": false,
    "disposable": true,
    "host_mounts": false,
    "mount_namespace": true,
    "network_mode": "DENY_ALL",
    "no_secrets": true,
    "pid_namespace": true,
    "rootless": true,
    "run_as_gid": 10001,
    "run_as_uid": 10001
  },
  "candidate_archive_sha256": "aaaaaaaaaaaaaaaaaaaaaaaaaaaaaaaaaaaaaaaaaaaaaaaaaaaaaaaaaaaaaaaa",
  "challenge_sha256": "bbbbbbbbbbbbbbbbbbbbbbbbbbbbbbbbbbbbbbbbbbbbbbbbbbbbbbbbbbbbbbbb",
  "completed_at": "2026-08-07T00:53:31.872362+00:00",
  "envelope_kind": "AZPR_V10_1_NO_SECRET_PROBE_RESULT",
  "exit_code": 0,
  "format_version": "1.1",
  "host_id": "host-v10-1-test-0001",
  "observations": {
    "daemon_access_denied": true,
    "escape_denied": true,
    "evidence_mutation_denied": true,
    "host_read_denied": true,
    "mount_denied": true,
    "network_denied": true,
    "resource_exhaustion_contained": true,
    "secret_read_denied": true
  },
  "probe_attestor_keyring_sha256": "bff18aed0ce158557a54717e9693be3e6b3caa3018e684068abf1dc5f61be656",
  "probe_attestor_revocation_state_sha256": "d54c7e53763120d2e30fc3a4723c52cfd43f957f55e29bab6690cf82c04e7d9e",
  "probe_keyring_sha256": "c1d92903ddf210f088a5d17ce61b5e644e5099feb2bfedf837c833d20aa660c4",
  "probe_policy_sha256": "f1ff2eaad2db77e472e68bb52de8a69deb5c7fbea5ca91da1182c8b6fdbc8f34",
  "probe_revocation_state_sha256": "fe5f6b803070adffafdd62447e653d0880f157d5439c71f7d2aa25b956693523",
  "probe_service_attestation_sha256": "6237faff3e4d8e70755727d20df0fb61948f73f9a07c75ca63107241340886ea",
  "probe_service_executable_sha256": "306c6ca7407560340797866e077e053627ad409277d1b9da58106fce4cf717cb",
  "probe_service_identity_sha256": "4b00f2125d58f084b2f99040caceb7560ab330b3f9f47a6e149195518c326a5f",
  "qualification_trust_manifest_sha256": "ce6eeaae56aa02b95c89e4404c8c336c0f967e46d14fb4867378182b0fe443ec",
  "signature": "sIifpFV7sQa/YjP7CZAldUWKtwbur/pJT4Ej6KxjQUN7eS/Fnr+pdfoHz8nkihQIMOD28xYIemddwIrQADt4BA==",
  "signer_key_id": "probe-key-v10-1-0001",
  "signer_service_id": "probe-service-v10-1-0001",
  "started_at": "2026-08-07T00:53:30.872362+00:00",
  "target_role": "qualification_verifier",
  "target_sha256": "2fe53921cbbaf949719f4643b54adf33aede7519ea7b15a91a84299badcdbd08"
}
