{
  "boundary": {
    "cgroup_v2": true,
    "daemon_sockets": false,
    "disposable": true,
    "host_mounts": false,
    "mount_namespace": true,
    "network_mode": "DENY_ALL",
    "no_secrets": true,
    "pid_namespace": true,
    "rootless": true,
    "run_as_gid": 10001,
    "run_as_uid": 10001
  },
  "candidate_archive_sha256": "aaaaaaaaaaaaaaaaaaaaaaaaaaaaaaaaaaaaaaaaaaaaaaaaaaaaaaaaaaaaaaaa",
  "challenge_sha256": "bbbbbbbbbbbbbbbbbbbbbbbbbbbbbbbbbbbbbbbbbbbbbbbbbbbbbbbbbbbbbbbb",
  "completed_at": "2026-08-07T00:32:33.644063+00:00",
  "envelope_kind": "AZPR_V10_1_NO_SECRET_PROBE_RESULT",
  "exit_code": 0,
  "format_version": "1.1",
  "host_id": "host-v10-1-test-0001",
  "observations": {
    "daemon_access_denied": true,
    "escape_denied": true,
    "evidence_mutation_denied": true,
    "host_read_denied": true,
    "mount_denied": true,
    "network_denied": true,
    "resource_exhaustion_contained": true,
    "secret_read_denied": true
  },
  "probe_attestor_keyring_sha256": "35f76612718b9e9bbbfc08eba86f698669202a48e41f596671f6aed48228a45a",
  "probe_attestor_revocation_state_sha256": "d0c6e32eca0861857f01e7b57a18be60670c1c8fe1644d1a4659041f44096f0d",
  "probe_keyring_sha256": "0e8f6fe18a248463e4d9b672d77040ffe522ca0cae629a52c6649091e77de371",
  "probe_policy_sha256": "f1ff2eaad2db77e472e68bb52de8a69deb5c7fbea5ca91da1182c8b6fdbc8f34",
  "probe_revocation_state_sha256": "feca0c741e841b6ab031e8cc2e8f5d623ea3ba9b27dc6b4005edf3f93b0306bf",
  "probe_service_attestation_sha256": "bd6a7938f78ba70524d4b1bbf1e1ce674af753f5ca51751f04d74531e9b82937",
  "probe_service_executable_sha256": "306c6ca7407560340797866e077e053627ad409277d1b9da58106fce4cf717cb",
  "probe_service_identity_sha256": "4b00f2125d58f084b2f99040caceb7560ab330b3f9f47a6e149195518c326a5f",
  "qualification_trust_manifest_sha256": "f09c0d3d64711d12dc5d33ae4b3640ec64c8b84694125740abc397cfcd87fdeb",
  "signature": "rSG65R27FHPlyz7LMgkCEkXommXuPwn6wcMO9pTZ4WNP3zhmxfR6My0tAa2xIrZrDgXlBZ51Atzk2bFbfi/7Aw==",
  "signer_key_id": "probe-key-v10-1-0001",
  "signer_service_id": "probe-service-v10-1-0001",
  "started_at": "2026-08-07T00:32:32.644063+00:00",
  "target_role": "python_binary",
  "target_sha256": "a7e6bad05d631409efed704f0f619441c32d249dc68842ac519a1bd272662b94"
}
