{
  "boundary": {
    "cgroup_v2": true,
    "daemon_sockets": false,
    "disposable": true,
    "host_mounts": false,
    "mount_namespace": true,
    "network_mode": "DENY_ALL",
    "no_secrets": true,
    "pid_namespace": true,
    "rootless": true,
    "run_as_gid": 10001,
    "run_as_uid": 10001
  },
  "candidate_archive_sha256": "aaaaaaaaaaaaaaaaaaaaaaaaaaaaaaaaaaaaaaaaaaaaaaaaaaaaaaaaaaaaaaaa",
  "challenge_sha256": "bbbbbbbbbbbbbbbbbbbbbbbbbbbbbbbbbbbbbbbbbbbbbbbbbbbbbbbbbbbbbbbb",
  "completed_at": "2026-08-06T23:32:31.326714+00:00",
  "envelope_kind": "AZPR_V10_1_NO_SECRET_PROBE_RESULT",
  "exit_code": 0,
  "format_version": "1.1",
  "host_id": "host-v10-1-test-0001",
  "observations": {
    "daemon_access_denied": true,
    "escape_denied": true,
    "evidence_mutation_denied": true,
    "host_read_denied": true,
    "mount_denied": true,
    "network_denied": true,
    "resource_exhaustion_contained": true,
    "secret_read_denied": true
  },
  "probe_attestor_keyring_sha256": "6a031d1d7e64e2bfe7cd0715e632c8033f90623107fa4b4e0d42a980326f09fb",
  "probe_attestor_revocation_state_sha256": "36bbbcf2e7679d0f449df75519ce0be85f918662889e37b034b542e340509907",
  "probe_keyring_sha256": "f79ef3a7fa4e2ed2ecf007a415504a7474e27f184e9c5fc7b0c23fea486d6cad",
  "probe_policy_sha256": "6237de74c498c2008e70f94719e7887c41f767e0ed51bcc1d7344e16ce4976dc",
  "probe_revocation_state_sha256": "44023e56165340ea55d137dce582ec763b7b01e4bc762d0e0d5c19c8f021c8c2",
  "probe_service_attestation_sha256": "f791efb57a7dfc46a99859f0e3cce3b79578cba88bc4fc6a5555673433a2ad86",
  "probe_service_executable_sha256": "306c6ca7407560340797866e077e053627ad409277d1b9da58106fce4cf717cb",
  "probe_service_identity_sha256": "4b00f2125d58f084b2f99040caceb7560ab330b3f9f47a6e149195518c326a5f",
  "qualification_trust_manifest_sha256": "b32ce5bcbaa8c24fdfcb64a17b0d7421674bd583c903d56f7fbdcfedeef70ec7",
  "signature": "aJfDy8wk4qAPdOmXv1jY43FUdDOEkUUIjdJYUBnHRvlT9BfwuP5sd1FmJgirgs/1i9M9zVtooskoJeLbUg0MCQ==",
  "signer_key_id": "probe-key-v10-1-0001",
  "signer_service_id": "probe-service-v10-1-0001",
  "started_at": "2026-08-06T23:32:30.326714+00:00",
  "target_role": "anchor_helper",
  "target_sha256": "9b8cfd6215d88b004c74b055a7134ef118b09d6a0fe536a07dd26e3f994fa8c6"
}
