{
  "boundary": {
    "cgroup_v2": true,
    "daemon_sockets": false,
    "disposable": true,
    "host_mounts": false,
    "mount_namespace": true,
    "network_mode": "DENY_ALL",
    "no_secrets": true,
    "pid_namespace": true,
    "rootless": true,
    "run_as_gid": 10001,
    "run_as_uid": 10001
  },
  "candidate_archive_sha256": "aaaaaaaaaaaaaaaaaaaaaaaaaaaaaaaaaaaaaaaaaaaaaaaaaaaaaaaaaaaaaaaa",
  "challenge_sha256": "bbbbbbbbbbbbbbbbbbbbbbbbbbbbbbbbbbbbbbbbbbbbbbbbbbbbbbbbbbbbbbbb",
  "completed_at": "2026-08-06T23:53:29.797803+00:00",
  "envelope_kind": "AZPR_V10_1_NO_SECRET_PROBE_RESULT",
  "exit_code": 0,
  "format_version": "1.1",
  "host_id": "host-v10-1-test-0001",
  "observations": {
    "daemon_access_denied": true,
    "escape_denied": true,
    "evidence_mutation_denied": true,
    "host_read_denied": true,
    "mount_denied": true,
    "network_denied": true,
    "resource_exhaustion_contained": true,
    "secret_read_denied": true
  },
  "probe_attestor_keyring_sha256": "f785ff1196238a84a2faef817ddb6f289134d3aadb2dbc36c073ec74e1fe763f",
  "probe_attestor_revocation_state_sha256": "8df752221a4223b1a13fcf8712dd684e40f062e41096aa34bb505b0b8001a6db",
  "probe_keyring_sha256": "365a02e8eb43d33dc4455709482e187807519ec1d7318d0be9a402a7b19d9f74",
  "probe_policy_sha256": "6237de74c498c2008e70f94719e7887c41f767e0ed51bcc1d7344e16ce4976dc",
  "probe_revocation_state_sha256": "a4544fcad269570553e8754d0f66bfb02f2511a936507ed23aafcd14b565d8c5",
  "probe_service_attestation_sha256": "4048784dd78e5efd9c5191ccb6ef627e6244847036780486f8b26f29fc4e307a",
  "probe_service_executable_sha256": "306c6ca7407560340797866e077e053627ad409277d1b9da58106fce4cf717cb",
  "probe_service_identity_sha256": "4b00f2125d58f084b2f99040caceb7560ab330b3f9f47a6e149195518c326a5f",
  "qualification_trust_manifest_sha256": "04bedf154c6df0e4f0e071b7625510f192874fce7414101a45dac290b27f808e",
  "signature": "jd8xMbWS7YnWWkP0NsmpgChFWXYpQAETBhhHPnr1pgtAOUgY/gcgy7o0YXTGNe6VsXVhY/uppsgiNB/ClM3aDQ==",
  "signer_key_id": "probe-key-v10-1-0001",
  "signer_service_id": "probe-service-v10-1-0001",
  "started_at": "2026-08-06T23:53:28.797803+00:00",
  "target_role": "qualification_verifier",
  "target_sha256": "2fe53921cbbaf949719f4643b54adf33aede7519ea7b15a91a84299badcdbd08"
}
