{
  "boundary": {
    "cgroup_v2": true,
    "daemon_sockets": false,
    "disposable": true,
    "host_mounts": false,
    "mount_namespace": true,
    "network_mode": "DENY_ALL",
    "no_secrets": true,
    "pid_namespace": true,
    "rootless": true,
    "run_as_gid": 10001,
    "run_as_uid": 10001
  },
  "candidate_archive_sha256": "aaaaaaaaaaaaaaaaaaaaaaaaaaaaaaaaaaaaaaaaaaaaaaaaaaaaaaaaaaaaaaaa",
  "challenge_sha256": "bbbbbbbbbbbbbbbbbbbbbbbbbbbbbbbbbbbbbbbbbbbbbbbbbbbbbbbbbbbbbbbb",
  "completed_at": "2026-08-06T23:53:29.605083+00:00",
  "envelope_kind": "AZPR_V10_1_NO_SECRET_PROBE_RESULT",
  "exit_code": 0,
  "format_version": "1.1",
  "host_id": "host-v10-1-test-0001",
  "observations": {
    "daemon_access_denied": true,
    "escape_denied": true,
    "evidence_mutation_denied": true,
    "host_read_denied": true,
    "mount_denied": true,
    "network_denied": true,
    "resource_exhaustion_contained": true,
    "secret_read_denied": true
  },
  "probe_attestor_keyring_sha256": "c113501893a85d288d92a590c399de5b61100582a8de1315877e8b9c86f54fdf",
  "probe_attestor_revocation_state_sha256": "b7f4de1b3c791713156751f39b4b46692415e22c02650fce5a9b7fc185a4fe9f",
  "probe_keyring_sha256": "87602c6c98be5179af1646f8e3e40ccd51261c4daf44715ce67c2f9fb44172cc",
  "probe_policy_sha256": "6237de74c498c2008e70f94719e7887c41f767e0ed51bcc1d7344e16ce4976dc",
  "probe_revocation_state_sha256": "37a525fa0a51c9052446a8e235d7046a28270d2ded6bb83f09958399c8e5ff3c",
  "probe_service_attestation_sha256": "525ca050d8d632bc3073a9356d7d444fc2ba16975bab024d05fba7ed2ade743b",
  "probe_service_executable_sha256": "306c6ca7407560340797866e077e053627ad409277d1b9da58106fce4cf717cb",
  "probe_service_identity_sha256": "4b00f2125d58f084b2f99040caceb7560ab330b3f9f47a6e149195518c326a5f",
  "qualification_trust_manifest_sha256": "9d4c000473709ca659b82a1d2a0fe7a777b343b7e876e6b1ea860573fcb903c2",
  "signature": "5e2PQQ5vgkjRzjAhtjrVi9fdrSdGUfEffdYdEEq7sw6m/OVUVgROCYY3P8Pfl5WM5YAq/6vM6JZaVwxzR4nWCg==",
  "signer_key_id": "probe-key-v10-1-0001",
  "signer_service_id": "probe-service-v10-1-0001",
  "started_at": "2026-08-06T23:53:28.605083+00:00",
  "target_role": "container_engine",
  "target_sha256": "76dfd71d6c0841a62b1e7df69c8e2e8b9200c17238eaa215e34f534d00665ec7"
}
