{
  "boundary": {
    "cgroup_v2": true,
    "daemon_sockets": false,
    "disposable": true,
    "host_mounts": false,
    "mount_namespace": true,
    "network_mode": "DENY_ALL",
    "no_secrets": true,
    "pid_namespace": true,
    "rootless": true,
    "run_as_gid": 10001,
    "run_as_uid": 10001
  },
  "candidate_archive_sha256": "aaaaaaaaaaaaaaaaaaaaaaaaaaaaaaaaaaaaaaaaaaaaaaaaaaaaaaaaaaaaaaaa",
  "challenge_sha256": "bbbbbbbbbbbbbbbbbbbbbbbbbbbbbbbbbbbbbbbbbbbbbbbbbbbbbbbbbbbbbbbb",
  "completed_at": "2026-08-07T00:32:29.200418+00:00",
  "envelope_kind": "AZPR_V10_1_NO_SECRET_PROBE_RESULT",
  "exit_code": 0,
  "format_version": "1.1",
  "host_id": "host-v10-1-test-0001",
  "observations": {
    "daemon_access_denied": true,
    "escape_denied": true,
    "evidence_mutation_denied": true,
    "host_read_denied": true,
    "mount_denied": true,
    "network_denied": true,
    "resource_exhaustion_contained": true,
    "secret_read_denied": true
  },
  "probe_attestor_keyring_sha256": "e62962c75908ebeace2ee2cb0cc82ee7b5e40f42f0bb4e373321217ffb89f8b1",
  "probe_attestor_revocation_state_sha256": "89d6622178a78c0fa9e180b5de4002636391a69975e86e8245199bf070c5f195",
  "probe_keyring_sha256": "89ca67f8cee3d106b3ed0b9cd0ea3365305fdc478500587aa33eaebc75a1d899",
  "probe_policy_sha256": "f1ff2eaad2db77e472e68bb52de8a69deb5c7fbea5ca91da1182c8b6fdbc8f34",
  "probe_revocation_state_sha256": "e74657914dea7ecf9bb599b8150b66b03388f9487a0694b62730d74485104ac6",
  "probe_service_attestation_sha256": "4585392077cfc6f9783ebb915dedfa286e713233051fde2bb996127bdb45ee8a",
  "probe_service_executable_sha256": "306c6ca7407560340797866e077e053627ad409277d1b9da58106fce4cf717cb",
  "probe_service_identity_sha256": "4b00f2125d58f084b2f99040caceb7560ab330b3f9f47a6e149195518c326a5f",
  "qualification_trust_manifest_sha256": "52cf94315dac3dc56c3965c63da8ca8bd7533d9406aab2f9f5791bf91c149fa7",
  "signature": "yBBv+0B2xft/UiFJagTKGKh0Hc0Atv5LNeLNLJ035/0yksXCoV0MHDhZuIapiol+s3M9EWcACtp+FjwBiQ12Dw==",
  "signer_key_id": "probe-key-v10-1-0001",
  "signer_service_id": "probe-service-v10-1-0001",
  "started_at": "2026-08-07T00:32:28.200418+00:00",
  "target_role": "container_engine",
  "target_sha256": "76dfd71d6c0841a62b1e7df69c8e2e8b9200c17238eaa215e34f534d00665ec7"
}
