{
  "boundary": {
    "cgroup_v2": true,
    "daemon_sockets": false,
    "disposable": true,
    "host_mounts": false,
    "mount_namespace": true,
    "network_mode": "ISOLATED_CONTROLLED_ENDPOINT_ONLY",
    "no_secrets": true,
    "pid_namespace": true,
    "rootless": true,
    "run_as_gid": 10001,
    "run_as_uid": 10001
  },
  "candidate_archive_sha256": "aaaaaaaaaaaaaaaaaaaaaaaaaaaaaaaaaaaaaaaaaaaaaaaaaaaaaaaaaaaaaaaa",
  "challenge_sha256": "bbbbbbbbbbbbbbbbbbbbbbbbbbbbbbbbbbbbbbbbbbbbbbbbbbbbbbbbbbbbbbbb",
  "completed_at": "2026-08-07T00:53:28.409158+00:00",
  "envelope_kind": "AZPR_V10_1_NO_SECRET_PROBE_RESULT",
  "exit_code": 0,
  "format_version": "1.1",
  "host_id": "host-v10-1-test-0001",
  "observations": {
    "daemon_access_denied": true,
    "escape_denied": true,
    "evidence_mutation_denied": true,
    "host_read_denied": true,
    "mount_denied": true,
    "network_denied": true,
    "resource_exhaustion_contained": true,
    "secret_read_denied": true
  },
  "probe_attestor_keyring_sha256": "694d5219a78a5ec9069e61dbf9d3bc905da018ac40bc2337dcd093c8a05b2f68",
  "probe_attestor_revocation_state_sha256": "243e0a0bf7074c44fc7c3a963c61e9bdcada381fb21404c58d24616e5568c250",
  "probe_keyring_sha256": "d5da78133ed1442fd38b9dc36ac83e753455700828918ed485c2e56495772b61",
  "probe_policy_sha256": "f1ff2eaad2db77e472e68bb52de8a69deb5c7fbea5ca91da1182c8b6fdbc8f34",
  "probe_revocation_state_sha256": "47dbb7be8aeebb5449bf82abc38146cf3a9290f17a7c0fa8ee85c40c86cad9e4",
  "probe_service_attestation_sha256": "ec94284500a65066f2e2a9b5566fcc71930beec7ded542641d38b95da62f16fd",
  "probe_service_executable_sha256": "306c6ca7407560340797866e077e053627ad409277d1b9da58106fce4cf717cb",
  "probe_service_identity_sha256": "4b00f2125d58f084b2f99040caceb7560ab330b3f9f47a6e149195518c326a5f",
  "qualification_trust_manifest_sha256": "709fd73ff9e1b9a7c4ee8150f5eda3a09d2c33938feda8cfedb2570efcc1dfed",
  "signature": "gPxPBeRQzmrAcurglQsU+Sdp4SL6Nn27f7Yt3N/5nxqYZzV6E490wpeyDASgfUg87F4iA18tbFMfA6wgEUDvCA==",
  "signer_key_id": "probe-key-v10-1-0001",
  "signer_service_id": "probe-service-v10-1-0001",
  "started_at": "2026-08-07T00:53:27.409158+00:00",
  "target_role": "mount_binary",
  "target_sha256": "ae95a6b14d4a820e815f1f53adebde74c51af26ba4e2a0fb87c47e579a80ea04"
}
